<?xml version="1.0" encoding="UTF-8"?>
<listOrg xmlns="http://www.tei-c.org/ns/1.0"
         xml:id="ParlaMint-BG-listOrg"
         xml:lang="bg">
   <org ana="#parla.national #parla.uni" role="parliament" xml:id="BGNS">
      <orgName full="yes" xml:lang="bg">Народно събрание на Република България</orgName>
      <orgName full="yes" xml:lang="en">National Assembly of the Republic of Bulgaria</orgName>
      <event from="1879-02-10">
         <label xml:lang="en">existence</label>
      </event>
      <idno subtype="wikimedia" type="URI" xml:lang="bg">https://bg.wikipedia.org/wiki/Народно_събрание</idno>
      <idno subtype="wikimedia" type="URI" xml:lang="en">https://en.wikipedia.org/wiki/National_Assembly_(Bulgaria)</idno>
      <listEvent>
         <head xml:lang="bg">Законодателен период</head>
         <head xml:lang="en">Legislative period</head>
         <event from="1991-11-04" to="1994-10-17" xml:id="BGNS.36">
            <label xml:lang="bg">36 Народно събрание</label>
            <label xml:lang="en">Term 36</label>
         </event>
         <event from="1995-01-12" to="1997-02-13" xml:id="BGNS.37">
            <label xml:lang="bg">37 Народно събрание</label>
            <label xml:lang="en">Term 37</label>
         </event>
         <event from="1997-05-07" to="2001-04-19" xml:id="BGNS.38">
            <label xml:lang="bg">38 Народно събрание</label>
            <label xml:lang="en">Term 38</label>
         </event>
         <event from="2001-07-05" to="2005-06-17" xml:id="BGNS.39">
            <label xml:lang="bg">39 Народно събрание</label>
            <label xml:lang="en">Term 39</label>
         </event>
         <event from="2005-07-11" to="2009-06-25" xml:id="BGNS.40">
            <label xml:lang="bg">40 Народно събрание</label>
            <label xml:lang="en">Term 40</label>
         </event>
         <event from="2009-07-14" to="2013-03-15" xml:id="BGNS.41">
            <label xml:lang="bg">41 Народно събрание</label>
            <label xml:lang="en">Term 41</label>
         </event>
         <event from="2013-05-21" to="2014-08-05" xml:id="BGNS.42">
            <label xml:lang="bg">42 Народно събрание</label>
            <label xml:lang="en">Term 42</label>
         </event>
         <event from="2014-10-27" to="2017-01-26" xml:id="BGNS.43">
            <label xml:lang="bg">43 Народно събрание</label>
            <label xml:lang="en">Term 43</label>
         </event>
         <event from="2017-04-19" to="2021-03-26" xml:id="BGNS.44">
            <label xml:lang="bg">44 Народно събрание</label>
            <label xml:lang="en">Term 44</label>
         </event>
         <event from="2021-04-15" to="2021-05-11" xml:id="BGNS.45">
            <label xml:lang="bg">45 Народно събрание</label>
            <label xml:lang="en">Term 45</label>
         </event>
         <event from="2021-07-21" to="2021-09-15" xml:id="BGNS.46">
            <label xml:lang="bg">46 Народно събрание</label>
            <label xml:lang="en">Term 46</label>
         </event>
         <event from="2021-12-03" to="2022-07-29" xml:id="BGNS.47">
            <label xml:lang="bg">47 Народно събрание</label>
            <label xml:lang="en">Term 47</label>
         </event>
         <event from="2022-10-19" xml:id="BGNS.48">
            <label xml:lang="bg">48 Народно събрание</label>
            <label xml:lang="en">Term 48</label>
         </event>
      </listEvent>
   </org>
   <org role="government" xml:id="gov.BGGov">
      <orgName full="yes" xml:lang="bg">Правителство на Република България</orgName>
      <orgName full="yes" xml:lang="en">Government of the Republic of Bulgaria</orgName>
      <event from="1990-12-20">
         <label xml:lang="en">existence</label>
      </event>
      <idno subtype="wikimedia" type="URI" xml:lang="bg">https://bg.wikipedia.org/wiki/Правителства_на_България</idno>
      <listEvent>
         <event from="1990-12-20" to="1991-11-08" xml:id="BGGov.81-Popov">
            <label xml:lang="bg">Правителство на Димитър Попов: 20.12.1990 - 08.11.1991</label>
         </event>
         <event from="1991-11-08" to="1992-12-30" xml:id="BGGov.82-DimotrovF">
            <label xml:lang="bg">Правителство на Филип Димитров: 08.11.1991 - 30.12.1992</label>
         </event>
         <event from="1992-12-30" to="1994-10-17" xml:id="BGGov.83-Berov">
            <label xml:lang="bg">Правителство на Любен Беров: 30.12.1992 - 17.10.1994</label>
         </event>
         <event from="1994-10-17" to="1995-01-25" xml:id="BGGov.84-Indzhova">
            <label xml:lang="bg">Служебно правителство на равителство на Ренета Инджова: 17.10.1994 - 25.01.1995</label>
         </event>
         <event from="1995-01-25" to="1997-02-12" xml:id="BGGov.85-Videnov">
            <label xml:lang="bg">Правителство на Жан Виденов: 25.01.1995 - 12.02.1997</label>
         </event>
         <event from="1997-02-12" to="1997-05-21" xml:id="BGGov.86-Sofiyanski">
            <label xml:lang="bg">Служебно правителство на равителство на Стефан Софиянски: 12.02.1997 - 21.05.1997</label>
         </event>
         <event from="1997-05-21" to="2001-07-24" xml:id="BGGov.87-Kostov">
            <label xml:lang="bg">Правителство на Иван Костов: 21.05.1997 - 24.07.2001</label>
         </event>
         <event from="2001-07-24"
                to="2005-08-17"
                xml:id="BGGov.88-Sakskoburggotski">
            <label xml:lang="bg">Правителство на Симеон Сакскобургготски: 24.07.2001 - 17.08.2005</label>
         </event>
         <event from="2005-08-17" to="2009-07-27" xml:id="BGGov.89-Stanishev">
            <label xml:lang="bg">Правителство на Сергей Станишев: 17.08.2005 - 27.07.2009</label>
         </event>
         <event from="2009-07-27" to="2013-03-13" xml:id="BGGov.90-Borisov_1">
            <label xml:lang="bg">Правителство на Бойко Борисов 1: 27.07.2009 - 13.03.2013</label>
         </event>
         <event from="2013-03-13" to="2013-05-29" xml:id="BGGov.91-Rajkov">
            <label xml:lang="bg">Служебно правителство на равителство на Марин Райков: 13.03.2013 - 29.05.2013</label>
         </event>
         <event from="2013-05-29" to="2014-08-06" xml:id="BGGov.92-Oresharski">
            <label xml:lang="bg">Правителство на Пламен Орешарски: 29.05.2013 - 06.08.2014</label>
         </event>
         <event from="2014-08-06" to="2014-11-07" xml:id="BGGov.93-Bliznashki">
            <label xml:lang="bg">Служебно правителство на равителство на Георги Близнашки: 06.08.2014 - 07.11.2014</label>
         </event>
         <event from="2014-11-07" to="2017-01-27" xml:id="BGGov.94-Borisov_2">
            <label xml:lang="bg">Правителство на Бойко Борисов 2: 07.11.2014 - 27.01.2017</label>
         </event>
         <event from="2017-01-27" to="2017-05-04" xml:id="BGGov.95-Gerdzhikov">
            <label xml:lang="bg">Служебно правителство на равителство на Огнян Герджиков: 27.01.2017 - 04.05.2017</label>
         </event>
         <event from="2017-05-04" to="2021-05-12" xml:id="BGGov.96-Borisov_3">
            <label xml:lang="bg">Правителство на Бойко Борисов 3: 04.05.2017 - 12.05.2021</label>
         </event>
         <event from="2021-05-12" to="2021-09-16" xml:id="BGGov.97-Yanev_1">
            <label xml:lang="bg">Служебно правителство на равителство на Стефан Янев 1: 12.05.2021 - 16.09.2021</label>
         </event>
         <event from="2021-09-16" to="2021-12-13" xml:id="BGGov.98-Yanev_2">
            <label xml:lang="bg">Служебно правителство на равителство на Стефан Янев 2: 16.09.2021 - 13.12.2021</label>
         </event>
         <event from="2021-12-13" to="2022-08-02" xml:id="BGGov.99-Petkov_K">
            <label xml:lang="bg">Правителство на Кирил Петков: 13.12.2021 - 02.08.2022</label>
         </event>
         <event from="2022-08-02" xml:id="BGGov.100-Donev">
            <label xml:lang="bg">Служебно правителство на Гълъб Донев: 02.08.2022 - в момента</label>
         </event>
      </listEvent>
   </org>
   <org role="republic" xml:id="republic.Bulgaria">
      <orgName full="yes" xml:lang="bg">Република България</orgName>
      <orgName full="yes" xml:lang="en">Republic of Bulgaria</orgName>
      <event from="1990-11-15">
         <label xml:lang="en">existence</label>
      </event>
      <idno subtype="wikimedia" type="URI" xml:lang="bg">https://bg.wikipedia.org/wiki/България</idno>
      <idno subtype="wikimedia" type="URI" xml:lang="en">https://en.wikipedia.org/wiki/Bulgaria</idno>
   </org>
   <org role="institution" xml:id="PRB">
      <orgName full="yes" xml:lang="bg">Прокуратура на Република България</orgName>
      <orgName full="yes" xml:lang="en">Prosecutor's Office of Republic of Bulgaria</orgName>
      <orgName full="abb" xml:lang="bg">ПРБ</orgName>
      <orgName full="abb" xml:lang="en">PRB</orgName>
      <event from="1880">
         <label xml:lang="en">existence</label>
      </event>
      <idno subtype="wikimedia" type="URI" xml:lang="bg">https://bg.wikipedia.org/wiki/Прокуратура_на_България</idno>
      <!-- no wikipage in English -->
   </org>
   <org role="institution" xml:id="BAS">
      <orgName full="yes" xml:lang="bg">Българска академия на науките</orgName>
      <orgName full="yes" xml:lang="en">Bulgarian Academy of Sciences</orgName>
      <orgName full="abb" xml:lang="bg">БАН</orgName>
      <orgName full="abb" xml:lang="en">BAS</orgName>
      <event from="1869">
         <label xml:lang="en">existence</label>
      </event>
      <idno subtype="wikimedia" type="URI" xml:lang="bg">https://bg.wikipedia.org/wiki/Българска_академия_на_науките</idno>
      <idno subtype="wikimedia" type="URI" xml:lang="en">https://en.wikipedia.org/wiki/Bulgarian_Academy_of_Sciences</idno>
   </org>
   <org role="europeanCommission" xml:id="europeanCommision.EC">
      <orgName full="yes" xml:lang="bg">Европейска комисия</orgName>
      <orgName full="yes" xml:lang="en">European Commission</orgName>
      <orgName full="abb" xml:lang="bg">ЕК</orgName>
      <orgName full="abb" xml:lang="en">EC</orgName>
      <event from="1967-06-01">
         <label xml:lang="en">existence</label>
      </event>
      <idno subtype="wikimedia" type="URI" xml:lang="bg">https://bg.wikipedia.org/wiki/Европейска_комисия</idno>
      <idno subtype="wikimedia" type="URI" xml:lang="en">https://en.wikipedia.org/wiki/European_Commission</idno>
   </org>
   <org role="europeanParliament" xml:id="europeanParliament.EP">
      <orgName full="yes" xml:lang="bg">Европейски парламент</orgName>
      <orgName full="yes" xml:lang="en">European Parliament</orgName>
      <orgName full="abb" xml:lang="bg">ЕП</orgName>
      <orgName full="abb" xml:lang="en">EP</orgName>
      <event from="1952-09-10">
         <label xml:lang="en">existence</label>
      </event>
      <idno subtype="wikimedia" type="URI" xml:lang="bg">https://bg.wikipedia.org/wiki/Европейски_парламент</idno>
      <idno subtype="wikimedia" type="URI" xml:lang="en">https://en.wikipedia.org/wiki/European_Parliament</idno>
   </org>
   <org role="parliamentaryGroup"
        xml:id="parliamentaryGroup.BSPLB"
        xml:lang="bg">
      <orgName full="yes" xml:lang="bg">Парламентарна група: БСП лява България</orgName>
      <orgName full="yes" xml:lang="en">Parliamentary Group: BSP Left Bulgaria</orgName>
      <orgName full="abb" xml:lang="bg-Latn">BSPLB</orgName>
      <event from="2014-10-27" to="2017-01-26">
         <label xml:lang="en">existence</label>
      </event>
      <idno subtype="wikimedia" type="URI" xml:lang="bg">https://bg.wikipedia.org/wiki/БСП_за_България</idno>
      <idno subtype="wikimedia" type="URI" xml:lang="en">https://en.wikipedia.org/wiki/BSP_for_Bulgaria</idno>
   </org>
   <org role="parliamentaryGroup"
        xml:id="parliamentaryGroup.BSPFB"
        xml:lang="bg">
      <orgName full="yes" xml:lang="bg">Парламентарна група: БСП за България</orgName>
      <orgName full="yes" xml:lang="en">Parliamentary Group: BSP for Bulgaria</orgName>
      <orgName full="abb" xml:lang="bg-Latn">BSPFB</orgName>
      <event from="2017-04-19">
         <label xml:lang="en">existence</label>
      </event>
      <idno subtype="wikimedia" type="URI" xml:lang="bg">https://bg.wikipedia.org/wiki/БСП_за_България</idno>
      <idno subtype="wikimedia" type="URI" xml:lang="en">https://en.wikipedia.org/wiki/BSP_for_Bulgaria</idno>
   </org>
   <org role="parliamentaryGroup"
        xml:id="parliamentaryGroup.WCC"
        xml:lang="bg">
      <orgName full="yes" xml:lang="bg">Парламентарна група: Продължаваме Промяната</orgName>
      <orgName full="yes" xml:lang="en">Parliamentary Group: We Continue the Change</orgName>
      <orgName full="abb" xml:lang="bg-Latn">WCC</orgName>
      <event from="2021-12-03">
         <label xml:lang="en">existence</label>
      </event>
      <idno subtype="wikimedia" type="URI" xml:lang="bg">https://bg.wikipedia.org/wiki/Продължаваме_промяната</idno>
      <idno subtype="wikimedia" type="URI" xml:lang="en">https://en.wikipedia.org/wiki/We_Continue_the_Change</idno>
   </org>
   <org role="parliamentaryGroup"
        xml:id="parliamentaryGroup.MRF"
        xml:lang="bg">
      <orgName full="yes" xml:lang="bg">Парламентарна група: Движение за права и свободи</orgName>
      <orgName full="yes" xml:lang="en">Parliamentary Group: Movement for Rights and Freedoms</orgName>
      <orgName full="abb" xml:lang="bg-Latn">MRF</orgName>
      <event from="1990-07-10">
         <label xml:lang="en">existence</label>
      </event>
      <idno subtype="wikimedia" type="URI" xml:lang="bg">https://bg.wikipedia.org/wiki/Движение_за_права_и_свободи</idno>
      <idno subtype="wikimedia" type="URI" xml:lang="en">https://en.wikipedia.org/wiki/Movement_for_Rights_and_Freedomse</idno>
   </org>
   <org role="parliamentaryGroup"
        xml:id="parliamentaryGroup.RUTO"
        xml:lang="bg">
      <orgName full="yes" xml:lang="bg">Парламентарна група: Изправи се! Мутри вън!</orgName>
      <orgName full="yes" xml:lang="en">Parliamentary Group: Rise up! Thugs out!</orgName>
      <orgName full="abb" xml:lang="bg-Latn">RUTO</orgName>
      <event from="2021-04-15" to="2022-05-11">
         <label xml:lang="en">existence</label>
      </event>
      <idno subtype="wikimedia" type="URI" xml:lang="bg">https://bg.wikipedia.org/wiki/Коалиция_Изправи_се!_Мутри_вън!</idno>
      <idno subtype="wikimedia" type="URI" xml:lang="es">https://es.wikipedia.org/wiki/%C2%A1De_pie!_%C2%A1Mafia,_fuera!</idno>
   </org>
   <org role="parliamentaryGroup"
        xml:id="parliamentaryGroup.RUBGWC"
        xml:lang="bg">
      <orgName full="yes" xml:lang="bg">Парламентарна група: Изправи_се_БГ!_Ние_идваме!</orgName>
      <orgName full="yes" xml:lang="en">Parliamentary Group: Rise up BG! We are coming!</orgName>
      <orgName full="abb" xml:lang="bg-Latn">RUBGWC</orgName>
      <event from="2021-07-21" to="2021-09-15">
         <label xml:lang="en">existence</label>
      </event>
      <idno subtype="wikimedia" type="URI" xml:lang="bg">https://bg.wikipedia.org/wiki/Изправи_се_БГ!_Ние_идваме</idno>
      <idno subtype="wikimedia" type="URI" xml:lang="en">https://en.wikipedia.org/wiki/Stand_Up.BG!_We_are_coming!</idno>
   </org>
   <org role="parliamentaryGroup"
        xml:id="parliamentaryGroup.BDC-NU"
        xml:lang="bg">
      <orgName full="yes" xml:lang="bg">Парламентарна група: Български демократичен център - Народен съюз</orgName>
      <orgName full="yes" xml:lang="en">Parliamentary Group: Bulgarian Democratic Centre - National Union</orgName>
      <orgName full="abb" xml:lang="bg-Latn">BDC-NU</orgName>
      <event from="2014-10-27" to="2017-01-26">
         <label xml:lang="en">existence</label>
      </event>
      <idno subtype="wikimedia" type="URI" xml:lang="bg">https://bg.wikipedia.org/wiki/Презареди_БГ</idno>
      <idno subtype="wikimedia" type="URI" xml:lang="en">https://en.wikipedia.org/wiki/Reload_Bulgaria</idno>
   </org>
   <org role="parliamentaryGroup"
        xml:id="parliamentaryGroup.DB"
        xml:lang="bg">
      <orgName full="yes" xml:lang="bg">Парламентарна група: Демократична България</orgName>
      <orgName full="yes" xml:lang="en">Parliamentary Group: Democratic Bulgaria</orgName>
      <orgName full="abb" xml:lang="bg-Latn">DB</orgName>
      <event from="2021-04-15">
         <label xml:lang="en">existence</label>
      </event>
      <idno subtype="wikimedia" type="URI" xml:lang="bg">https://bg.wikipedia.org/wiki/Демократична_България</idno>
      <idno subtype="wikimedia" type="URI" xml:lang="en">https://en.wikipedia.org/wiki/Democratic_Bulgaria</idno>
   </org>
   <org role="parliamentaryGroup"
        xml:id="parliamentaryGroup.TISP"
        xml:lang="bg">
      <orgName full="yes" xml:lang="bg">Парламентарна група: Има такъв народ</orgName>
      <orgName full="yes" xml:lang="en">Parliamentary Group: There Is Such People</orgName>
      <orgName full="abb" xml:lang="bg-Latn">TISP</orgName>
      <event from="2021-04-15" to="2022-08-01">
         <label xml:lang="en">existence</label>
      </event>
      <idno subtype="wikimedia" type="URI" xml:lang="bg">https://bg.wikipedia.org/wiki/Има_такъв_народ</idno>
      <idno subtype="wikimedia" type="URI" xml:lang="en">https://en.wikipedia.org/wiki/There_is_Such_a_People</idno>
   </org>
   <org role="parliamentaryGroup"
        xml:id="parliamentaryGroup.AP"
        xml:lang="bg">
      <orgName full="yes" xml:lang="bg">Парламентарна група: Партия Атака</orgName>
      <orgName full="yes" xml:lang="en">Parliamentary Group: Ataka Party</orgName>
      <orgName full="abb" xml:lang="bg-Latn">AP</orgName>
      <event from="2009-07-14" to="2017-01-26">
         <label xml:lang="en">existence</label>
      </event>
      <idno subtype="wikimedia" type="URI" xml:lang="bg">https://bg.wikipedia.org/wiki/Атака_(партия)</idno>
      <idno subtype="wikimedia" type="URI" xml:lang="en">https://en.wikipedia.org/wiki/Attack_(politicalParty)</idno>
   </org>
   <org role="parliamentaryGroup"
        xml:id="parliamentaryGroup.GERB"
        xml:lang="bg">
      <orgName full="yes" xml:lang="bg">Парламентарна група: Партия ГЕРБ</orgName>
      <orgName full="yes" xml:lang="en">Parliamentary Group: GERB Party</orgName>
      <orgName full="abb" xml:lang="bg-Latn">GERB</orgName>
      <event from="2005-07-14" to="2021-03-26">
         <label xml:lang="en">existence</label>
      </event>
      <idno subtype="wikimedia" type="URI" xml:lang="bg">https://bg.wikipedia.org/wiki/ГЕРБ</idno>
      <idno subtype="wikimedia" type="URI" xml:lang="en">https://en.wikipedia.org/wiki/GERB</idno>
   </org>
   <org role="parliamentaryGroup"
        xml:id="parliamentaryGroup.GERB-UDF"
        xml:lang="bg">
      <orgName full="yes" xml:lang="bg">Парламентарна група: ГЕРБ-СДС</orgName>
      <orgName full="yes" xml:lang="en">Parliamentary Group: GERB-UDF</orgName>
      <orgName full="abb" xml:lang="bg-Latn">GERB-UDF</orgName>
      <event from="2021-04-15">
         <label xml:lang="en">existence</label>
      </event>
   </org>
   <org role="parliamentaryGroup"
        xml:id="parliamentaryGroup.UP"
        xml:lang="bg">
      <orgName full="yes" xml:lang="bg">Парламентарна група: Обединени патриоти</orgName>
      <orgName full="yes" xml:lang="en">Parliamentary Group: United Patriots</orgName>
      <orgName full="abb" xml:lang="bg-Latn">UP</orgName>
      <event from="2017-04-15" to="2021-03-26">
         <label xml:lang="en">existence</label>
      </event>
      <idno subtype="wikimedia" type="URI" xml:lang="bg">https://bg.wikipedia.org/wiki/Обединени_патриоти</idno>
      <idno subtype="wikimedia" type="URI" xml:lang="en">https://en.wikipedia.org/wiki/United_Patriots</idno>
   </org>
   <org role="parliamentaryGroup"
        xml:id="parliamentaryGroup.ABV"
        xml:lang="bg">
      <orgName full="yes" xml:lang="bg">Парламентарна група: Алтернатива за българско възраждане</orgName>
      <orgName full="yes" xml:lang="en">Parliamentary Group: Alternative for Bulgarian Revival</orgName>
      <orgName full="abb" xml:lang="bg-Latn">ABV</orgName>
      <event from="2014-10-27" to="2017-01-26">
         <label xml:lang="en">existence</label>
      </event>
      <idno subtype="wikimedia" type="URI" xml:lang="bg">https://bg.wikipedia.org/wiki/Алтернатива_за_българско_възраждане</idno>
      <idno subtype="wikimedia" type="URI" xml:lang="en">https://en.wikipedia.org/wiki/Alternative_for_Bulgarian_Revival</idno>
   </org>
   <org role="parliamentaryGroup"
        xml:id="parliamentaryGroup.RB"
        xml:lang="bg">
      <orgName full="yes" xml:lang="bg">Парламентарна група: Реформаторски блок</orgName>
      <orgName full="yes" xml:lang="en">Parliamentary Group: Reformist Bloc</orgName>
      <orgName full="abb" xml:lang="bg-Latn">RB</orgName>
      <event from="2014-10-27" to="2017-01-26">
         <label xml:lang="en">existence</label>
      </event>
      <idno subtype="wikimedia" type="URI" xml:lang="bg">https://bg.wikipedia.org/wiki/Реформаторски_блок</idno>
      <idno subtype="wikimedia" type="URI" xml:lang="en">https://en.wikipedia.org/wiki/Reformist_Bloc</idno>
   </org>
   <org role="parliamentaryGroup"
        xml:id="parliamentaryGroup.PF"
        xml:lang="bg">
      <orgName full="yes" xml:lang="bg">Парламентарна група: Патриотичен фронт</orgName>
      <orgName full="yes" xml:lang="en">Parliamentary Group: Patriotic Front</orgName>
      <orgName full="abb" xml:lang="bg-Latn">PF</orgName>
      <event from="2014-10-27" to="2017-01-26">
         <label xml:lang="en">existence</label>
      </event>
      <idno subtype="wikimedia" type="URI" xml:lang="bg">https://bg.wikipedia.org/wiki/Патриотичен_фронт</idno>
      <idno subtype="wikimedia" type="URI" xml:lang="en">https://en.wikipedia.org/wiki/Patriotic_Front_(Bulgaria,_2014)</idno>
   </org>
   <org role="parliamentaryGroup"
        xml:id="parliamentaryGroup.VOLYA"
        xml:lang="bg">
      <orgName full="yes" xml:lang="bg">Парламентарна група: ВОЛЯ - Българските Родолюбци</orgName>
      <orgName full="yes" xml:lang="en">Parliamentary Group: Volya</orgName>
      <orgName full="abb" xml:lang="bg-Latn">VOLYA</orgName>
      <event from="2017-04-15" to="2021-03-26">
         <label xml:lang="en">existence</label>
      </event>
      <idno subtype="wikimedia" type="URI" xml:lang="bg">https://bg.wikipedia.org/wiki/Воля_(партия)</idno>
      <idno subtype="wikimedia" type="URI" xml:lang="en">https://en.wikipedia.org/wiki/Volya_Movement</idno>
   </org>
   <org role="parliamentaryGroup"
        xml:id="parliamentaryGroup.RP"
        xml:lang="bg">
      <orgName full="yes" xml:lang="bg">Парламентарна група: Партия Възраждане</orgName>
      <orgName full="yes" xml:lang="en">Parliamentary Group: Revival Party</orgName>
      <orgName full="abb" xml:lang="bg-Latn">RP</orgName>
      <event from="2021-12-03">
         <label xml:lang="en">existence</label>
      </event>
      <idno subtype="wikimedia" type="URI" xml:lang="bg">https://bg.wikipedia.org/wiki/Възраждане_(партия_в_България)</idno>
      <idno subtype="wikimedia" type="URI" xml:lang="en">https://en.wikipedia.org/wiki/Revival_(Bulgarian_politicalParty)</idno>
   </org>
   <org role="politicalParty" xml:id="party.GERB">
      <orgName full="yes" xml:lang="bg">Граждани за европейско развитие на България</orgName>
      <orgName full="abb" xml:lang="en">GERB</orgName>
      <orgName full="abb" xml:lang="bg-Latn">ГЕРБ</orgName>
      <event from="2006-12-03">
         <label xml:lang="en">existence</label>
      </event>
      <idno subtype="wikimedia" type="URI" xml:lang="bg">https://bg.wikipedia.org/wiki/ГЕРБ</idno>
      <idno subtype="wikimedia" type="URI" xml:lang="en">https://en.wikipedia.org/wiki/GERB</idno>
   </org>
   <org role="politicalParty" xml:id="party.BSP">
      <orgName full="yes" xml:lang="bg">Българска социалистическа партия</orgName>
      <orgName full="yes" xml:lang="en">Bulgarian Socialist Party</orgName>
      <orgName full="abb" xml:lang="bg-Latn">БСП</orgName>
      <event from="1891-07-20">
         <label xml:lang="en">existence</label>
      </event>
      <idno subtype="wikimedia" type="URI" xml:lang="bg">https://bg.wikipedia.org/wiki/Българска_социалистическа_партия</idno>
      <idno subtype="wikimedia" type="URI" xml:lang="en">https://en.wikipedia.org/wiki/Bulgarian_Socialist_Party</idno>
   </org>
   <org role="politicalParty" xml:id="party.KPB">
      <orgName full="yes" xml:lang="bg">Комунистическа партия на България</orgName>
      <orgName full="yes" xml:lang="en">Communist Party of Bulgaria</orgName>
      <orgName full="abb" xml:lang="bg-Latn">КПБ</orgName>
      <event from="1996">
         <label xml:lang="en">existence</label>
      </event>
      <idno subtype="wikimedia" type="URI" xml:lang="bg">https://bg.wikipedia.org/wiki/Комунистическа_партия_на_България</idno>
      <idno subtype="wikimedia" type="URI" xml:lang="en">https://en.wikipedia.org/wiki/Communist_Party_of_Bulgaria</idno>
   </org>
   <org role="politicalParty" xml:id="party.ZS">
      <orgName full="yes" xml:lang="bg">Земеделски съюз „Александър Стамболийски“</orgName>
      <orgName full="yes" xml:lang="en">Agrarian Union "Aleksandar Stamboliyski"</orgName>
      <orgName full="abb" xml:lang="bg">ЗС „Александър Стамболийски“</orgName>
      <event from="1993">
         <label xml:lang="en">existence</label>
      </event>
      <idno subtype="wikimedia" type="URI" xml:lang="bg">https://bg.wikipedia.org/wiki/Земеделски_съюз_„Александър_Стамболийски“</idno>
      <idno subtype="wikimedia" type="URI" xml:lang="en">https://en.wikipedia.org/wiki/Agrarian_Union_"Aleksandar_Stamboliyski"</idno>
   </org>
   <org role="politicalParty" xml:id="party.NZ">
      <orgName full="yes" xml:lang="bg">Нова зора</orgName>
      <orgName full="yes" xml:lang="en">New Dawn</orgName>
      <orgName full="abb" xml:lang="bg">НЗ</orgName>
      <event from="1996-03">
         <label xml:lang="en">existence</label>
      </event>
      <idno subtype="wikimedia" type="URI" xml:lang="bg">https://bg.wikipedia.org/wiki/Нова_зора_(партия)</idno>
   </org>
   <org role="ngo" xml:id="party.EKO">
      <orgName full="yes" xml:lang="bg">Независимо сдружение „Екогласност“</orgName>
      <orgName full="yes" xml:lang="en">Ecoglasnost</orgName>
      <event from="1989-04-11">
         <label xml:lang="en">existence</label>
      </event>
      <idno subtype="wikimedia" type="URI" xml:lang="bg">https://bg.wikipedia.org/wiki/Независимо_сдружение_„Екогласност“</idno>
      <idno subtype="wikimedia" type="URI" xml:lang="en">https://en.wikipedia.org/wiki/Ecoglasnost</idno>
   </org>
   <org role="politicalParty" xml:id="party.DPS">
      <orgName full="yes" xml:lang="bg">Движение за права и свободи</orgName>
      <orgName full="yes" xml:lang="en">Movement for Rights and Freedoms</orgName>
      <orgName full="abb" xml:lang="bg">ДПС</orgName>
      <event from="1990-01-04">
         <label xml:lang="en">existence</label>
      </event>
      <idno subtype="wikimedia" type="URI" xml:lang="bg">https://bg.wikipedia.org/wiki/Движение_за_права_и_свободи</idno>
      <idno subtype="wikimedia" type="URI" xml:lang="en">https://en.wikipedia.org/wiki/Movement_for_Rights_and_Freedoms</idno>
   </org>
   <org role="politicalParty" xml:id="party.VMRO">
      <orgName full="yes" xml:lang="bg">ВМРО – Българско национално движение</orgName>
      <orgName full="yes" xml:lang="en">IMRO – Bulgarian National Movement</orgName>
      <orgName full="abb" xml:lang="bg">ВМРО–БНД</orgName>
      <event from="1989">
         <label xml:lang="en">existence</label>
      </event>
      <idno subtype="wikimedia" type="URI" xml:lang="bg">https://bg.wikipedia.org/wiki/ВМРО_–_Българско_национално_движение</idno>
      <idno subtype="wikimedia" type="URI" xml:lang="en">https://en.wikipedia.org/wiki/IMRO_%E2%80%93_Bulgarian_National_Movement</idno>
   </org>
   <org role="politicalParty" xml:id="party.FRONT">
      <orgName full="yes" xml:lang="bg">Национален фронт за спасение на България</orgName>
      <orgName full="yes" xml:lang="en">National Front for the Salvation of Bulgaria</orgName>
      <orgName full="abb" xml:lang="bg">НФСБ</orgName>
      <event from="2011-05-17">
         <label xml:lang="en">existence</label>
      </event>
      <idno subtype="wikimedia" type="URI" xml:lang="bg">https://bg.wikipedia.org/wiki/Национален_фронт_за_спасение_на_България</idno>
      <idno subtype="wikimedia" type="URI" xml:lang="en">https://en.wikipedia.org/wiki/National_Front_for_the_Salvation_of_Bulgaria</idno>
   </org>
   <org role="politicalParty" xml:id="party.ATAKA">
      <orgName full="yes" xml:lang="bg">Атака</orgName>
      <orgName full="abb" xml:lang="bg">Атака</orgName>
      <orgName full="yes" xml:lang="en">Attack</orgName>
      <event from="2005-04-17">
         <label xml:lang="en">existence</label>
      </event>
      <idno subtype="wikimedia" type="URI" xml:lang="bg">https://bg.wikipedia.org/wiki/Атака_(партия)</idno>
      <idno subtype="wikimedia" type="URI" xml:lang="en">https://en.wikipedia.org/wiki/Attack_(politicalParty)</idno>
   </org>
   <org role="politicalParty" xml:id="party.VOLYA">
      <orgName full="abb" xml:lang="bg">ВОЛЯ</orgName>
      <orgName full="yes" xml:lang="bg">ВОЛЯ</orgName>
      <orgName full="yes" xml:lang="en">Volya Movement</orgName>
      <event from="2007-07-15">
         <label xml:lang="en">existence</label>
      </event>
      <idno subtype="wikimedia" type="URI" xml:lang="bg">https://bg.wikipedia.org/wiki/Воля_(партия)</idno>
      <idno subtype="wikimedia" type="URI" xml:lang="en">https://en.wikipedia.org/wiki/Volya_Movement</idno>
   </org>
   <org role="politicalParty" xml:id="party.ABV">
      <orgName full="yes" xml:lang="bg">Алтернатива за българско възраждане</orgName>
      <orgName full="yes" xml:lang="en">Alternative for Bulgarian Revival</orgName>
      <orgName full="abb" xml:lang="bg">АБВ</orgName>
      <event from="2014">
         <label xml:lang="en">existence</label>
      </event>
      <idno subtype="wikimedia" type="URI" xml:lang="bg">https://bg.wikipedia.org/wiki/Алтернатива_за_българско_възраждане</idno>
      <idno subtype="wikimedia" type="URI" xml:lang="en">https://en.wikipedia.org/wiki/Alternative_for_Bulgarian_Revival</idno>
   </org>
   <org role="politicalParty" xml:id="party.BGUn">
      <orgName full="abb" xml:lang="bg">ПБГ</orgName>
      <orgName from="2014-01-25" full="yes" to="2017-01-07" xml:lang="bg">България без цензура</orgName>
      <orgName from="2017-01-07" full="yes" xml:lang="bg">Презареди БГ</orgName>
      <orgName from="2014-01-25" full="yes" to="2017-01-07" xml:lang="en">Bulgaria Uncensored</orgName>
      <orgName from="2017-01-07" full="yes" xml:lang="en">Reload Bulgaria</orgName>
      <event from="2014">
         <label xml:lang="en">existence</label>
      </event>
      <idno subtype="wikimedia" type="URI" xml:lang="bg">https://bg.wikipedia.org/wiki/Презареди_БГ</idno>
      <idno subtype="wikimedia" type="URI" xml:lang="en">https://en.wikipedia.org/wiki/Reload_Bulgaria</idno>
   </org>
   <org role="politicalParty" xml:id="party.RB">
      <orgName from="2013-12-20" full="yes" xml:lang="bg">Реформаторски блок</orgName>
      <orgName from="2013-12-20" full="yes" xml:lang="en">Reformist Bloc</orgName>
      <orgName full="abb" xml:lang="bg">РБ</orgName>
      <event from="2013">
         <label xml:lang="en">existence</label>
      </event>
      <idno subtype="wikimedia" type="URI" xml:lang="bg">https://bg.wikipedia.org/wiki/Реформаторски_блок</idno>
      <idno subtype="wikimedia" type="URI" xml:lang="en">https://en.wikipedia.org/wiki/Reformist_Bloc</idno>
   </org>
   <org role="politicalParty" xml:id="party.PF">
      <orgName from="2014-08-03" full="yes" to="2017-01-27" xml:lang="bg">Патриотичен фронт</orgName>
      <orgName from="2014-08-03" full="yes" to="2017-01-27" xml:lang="en">Patriotic Front</orgName>
      <orgName full="abb" xml:lang="bg">ПФ</orgName>
      <event from="2014">
         <label xml:lang="en">existence</label>
      </event>
      <idno subtype="wikimedia" type="URI" xml:lang="bg">https://bg.wikipedia.org/wiki/Патриотичен фронт</idno>
      <idno subtype="wikimedia" type="URI" xml:lang="en">https://en.wikipedia.org/wiki/Patriotic_Front_(Bulgaria)</idno>
   </org>
   <org role="politicalParty" xml:id="party.ITN">
      <orgName full="yes" xml:lang="bg">Има такъв народ</orgName>
      <orgName full="yes" xml:lang="en">There is Such a People</orgName>
      <orgName full="abb" xml:lang="bg-Latn">ITN</orgName>
      <event from="2020-02-16">
         <label xml:lang="en">existence</label>
      </event>
      <idno type="wikimedia" xml:lang="bg">https://bg.wikipedia.org/wiki/Има_такъв_народ</idno>
      <idno type="wikimedia" xml:lang="en">https://en.wikipedia.org/wiki/There_is_Such_a_People</idno>
   </org>
   <org role="politicalParty" xml:id="party.RUTO">
      <orgName full="yes" xml:lang="bg">Изправи се! Мутри вън!</orgName>
      <orgName full="yes" xml:lang="en">Rise up! Thugs out!</orgName>
      <orgName full="abb" xml:lang="bg-Latn">RUTO</orgName>
      <event from="2021-02-07" to="2021-07-20">
         <label xml:lang="en">existence</label>
      </event>
      <idno type="wikimedia" xml:lang="bg">https://bg.wikipedia.org/wiki/Коалиция_Изправи_се!_Мутри_вън!</idno>
   </org>
   <org role="politicalParty" xml:id="party.DABG">
      <orgName full="yes" xml:lang="bg">„Да, България“</orgName>
      <orgName full="yes" xml:lang="en">Yes, Bulgaria!</orgName>
      <orgName full="abb" xml:lang="bg-Latn">DABG</orgName>
      <event from="2017-01-07">
         <label xml:lang="en">existence</label>
      </event>
      <idno type="wikimedia" xml:lang="bg">https://bg.wikipedia.org/wiki/Движение_„Да,_България“</idno>
      <idno type="wikimedia" xml:lang="en">https://en.wikipedia.org/wiki/Yes,_Bulgaria!</idno>
   </org>
   <org role="politicalParty" xml:id="party.DSB">
      <orgName full="yes" xml:lang="bg">Демократи за силна България</orgName>
      <orgName full="yes" xml:lang="en">Democrats for a Strong Bulgaria</orgName>
      <orgName full="abb" xml:lang="bg-Latn">DSB</orgName>
      <event from="2004-05-30">
         <label xml:lang="en">existence</label>
      </event>
      <idno type="wikimedia" xml:lang="bg">https://bg.wikipedia.org/wiki/Демократи_за_силна_България</idno>
      <idno type="wikimedia" xml:lang="en">https://en.wikipedia.org/wiki/Democrats_for_a_Strong_Bulgaria</idno>
   </org>
   <org role="politicalParty" xml:id="party.GrMov">
      <orgName full="yes" xml:lang="bg">Зелено движение</orgName>
      <orgName full="yes" xml:lang="en">Green Movement</orgName>
      <orgName full="abb" xml:lang="bg-Latn">GrMov</orgName>
      <event from="2004-05-30">
         <label xml:lang="en">existence</label>
      </event>
      <idno type="wikimedia" xml:lang="bg">https://bg.wikipedia.org/wiki/Зелено_движение</idno>
      <idno type="wikimedia" xml:lang="en">https://en.wikipedia.org/wiki/Green_Movement_(Bulgaria)</idno>
   </org>
   <org role="politicalParty" xml:id="party.WCC">
      <orgName full="yes" xml:lang="bg">Продължаваме промяната</orgName>
      <orgName full="yes" xml:lang="en">We Continue the Change</orgName>
      <orgName full="abb" xml:lang="bg-Latn">WCC</orgName>
      <event from="2022-04-15">
         <label xml:lang="en">existence</label>
      </event>
      <idno type="wikimedia" xml:lang="bg">https://bg.wikipedia.org/wiki/Продължаваме_промяната</idno>
      <idno type="wikimedia" xml:lang="en">https://en.wikipedia.org/wiki/We_Continue_the_Change</idno>
   </org>
   <listRelation>
      <relation ana="#BGNS.43"
                from="2014-11-07"
                mutual="#parliamentaryGroup.GERB #parliamentaryGroup.ABV #parliamentaryGroup.RB"
                name="coalition"
                to="2017-01-27"/>
      <relation active="#parliamentaryGroup.BSPLB #parliamentaryGroup.MRF #parliamentaryGroup.PF"
                ana="#BGGov.94-Borisov_2 #BGNS.43"
                from="2014-11-07"
                name="opposition"
                passive="#gov.BGGov"
                to="2017-01-27"/>
      <relation ana="#BGNS.44"
                from="2017-05-04"
                mutual="#parliamentaryGroup.GERB #parliamentaryGroup.UP"
                name="coalition"
                to="2021-05-12"/>
      <relation active="#parliamentaryGroup.BSPFB #parliamentaryGroup.MRF #parliamentaryGroup.VOLYA"
                ana="#BGGov.96-Borisov_3 #BGNS.44"
                from="2017-05-04"
                name="opposition"
                passive="#gov.BGGov"
                to="2021-05-12"/>
      <relation ana="#BGNS.47"
                from="2021-12-13"
                mutual="#parliamentaryGroup.WCC #parliamentaryGroup.DB #parliamentaryGroup.BSPFB #parliamentaryGroup.TISP"
                name="coalition"
                to="2022-08-02"/>
      <relation active="#parliamentaryGroup.GERB-UDF #parliamentaryGroup.MRF #parliamentaryGroup.RP"
                ana="#BGGov.99-Petkov_K #BGNS.47"
                from="2021-12-13"
                name="opposition"
                passive="#gov.BGGov"
                to="2022-08-02"/>
   </listRelation>
</listOrg>
